{
  "id": "china-additive-manufacturing-alliance",
  "name": {
    "en": "China Additive Manufacturing Alliance",
    "zh": "中国增材制造产业联盟"
  },
  "description": {
    "en": "Established on October 19, 2016, under the guidance of the Ministry of Industry and Information Technology (MIIT), the China Additive Manufacturing Alliance (CAMA) was jointly initiated by 128 organizations including enterprises, universities, research institutions, and industrial parks in the additive manufacturing field. The alliance currently has over 330 member organizations and serves as China's highest-level and largest industry organization in the additive manufacturing sector. It functions as a bridge connecting industry, academia, finance, government, and application sectors, providing comprehensive industry data, publishing the annual China Additive Manufacturing Industry Yearbook, and issuing monthly industry development briefings.",
    "zh": "中国增材制造产业联盟于2016年10月19日在工业和信息化部指导下成立，由增材制造领域128家企业、高校、科研院所、产业园区等单位共同发起。联盟现有会员单位330余家，是中国增材制造领域最高层次、规模最大的行业组织。联盟充分发挥桥梁与纽带作用，搭建增材制造行业与产业、学术、金融、政府、行业应用领域的交流通道，统筹全国范围内增材制造的科学研究、技术研发、设备材料、技术服务、配套服务等资源，为会员单位搭建供需对接及展示平台，系统、全面、清晰地汇总国内增材制造在新闻咨询、法规政策、行业标准、商品门类等方面的信息资源，促进增材制造技术在航空航天、生物医疗、军民融合、工业工程等重要领域的推广应用。"
  },
  "website": "https://www.niiam.com/union/",
  "data_url": "https://www.miit-eidc.org.cn",
  "api_url": null,
  "country": "CN",
  "domains": [
    "Additive Manufacturing",
    "3D Printing",
    "Advanced Manufacturing",
    "Industrial Statistics",
    "Manufacturing Technology",
    "Materials Science",
    "Equipment Manufacturing"
  ],
  "geographic_scope": "national",
  "update_frequency": "monthly",
  "tags": [
    "additive-manufacturing",
    "增材制造",
    "3d-printing",
    "3D打印",
    "manufacturing",
    "制造业",
    "industrial-statistics",
    "产业统计",
    "equipment",
    "设备",
    "materials",
    "材料",
    "industry-report",
    "行业报告",
    "yearbook",
    "年鉴",
    "technology-innovation",
    "技术创新",
    "aerospace",
    "航空航天",
    "biomedical",
    "生物医疗",
    "industrial-engineering",
    "工业工程",
    "cama",
    "中国增材制造产业联盟"
  ],
  "data_content": {
    "en": [
      "Industry Statistics - Production, consumption, market size, and growth rates of China's additive manufacturing industry",
      "Equipment Data - 3D printing equipment production volumes, export volumes, and installed capacity statistics",
      "Market Analysis - Industry segmentation data including equipment (53.2%), services (26%), components (12.4%), and materials (5.9%)",
      "Enterprise Information - Directory and profiles of 330+ member organizations including manufacturers, research institutions, and universities",
      "Technology Innovation - New technology development, patent applications, and R&D investment in additive manufacturing",
      "Application Sectors - Usage data across aerospace, biomedical, automotive, industrial engineering, and other sectors",
      "Annual Yearbook - Comprehensive annual report covering industry development, policy information, and enterprise data",
      "Monthly Briefings - Monthly industry development reports with latest trends, statistics, and market updates",
      "Member Resources - Database of 3D printing equipment, materials, software, components, and printing services from member units",
      "Policy Information - National and regional policies, regulations, and industry standards for additive manufacturing"
    ],
    "zh": [
      "产业统计 - 中国增材制造产业的产量、消费量、市场规模和增长率数据",
      "设备数据 - 3D打印设备生产量、出口量和装机容量统计",
      "市场分析 - 行业细分数据，包括设备（53.2%）、服务（26%）、零部件（12.4%）和材料（5.9%）",
      "企业信息 - 330余家会员单位的目录和简介，包括制造商、研究机构和高校",
      "技术创新 - 增材制造领域的新技术开发、专利申请和研发投资",
      "应用领域 - 航空航天、生物医疗、汽车、工业工程等领域的应用数据",
      "年度年鉴 - 全面的年度报告，涵盖产业发展、政策信息和企业数据",
      "月度简报 - 月度产业发展报告，包含最新趋势、统计数据和市场动态",
      "会员资源 - 会员单位提供的3D打印设备、材料、软件、配件和打印服务数据库",
      "政策信息 - 增材制造的国家和区域政策、法规和行业标准"
    ]
  },
  "authority_level": "market"
}
